{
  "$schema": "https://json-schema.org/draft/2020-12/schema",
  "$id": "https://globalgrid2050.com/reports/schemas/journey.schema.json",
  "title": "GlobalGrid2050 Journey JSON",
  "type": "object",
  "additionalProperties": false,
  "required": ["journey_id", "title", "created_at", "storage_model", "entries"],
  "properties": {
    "journey_id": { "type": "string", "minLength": 1 },
    "title": { "type": "string", "minLength": 1 },
    "created_at": { "type": "string", "format": "date-time" },
    "kernel_registry_version": { "type": ["integer", "string", "null"] },
    "storage_model": {
      "type": "string",
      "enum": ["in_memory", "indexeddb", "opfs", "downloaded_json", "synthetic"]
    },
    "entries": {
      "type": "array",
      "minItems": 1,
      "items": {
        "type": "object",
        "additionalProperties": false,
        "required": ["step_id", "timestamp", "application", "action", "evidence_ids"],
        "properties": {
          "step_id": { "type": "string" },
          "timestamp": { "type": "string", "format": "date-time" },
          "application": { "type": "string" },
          "action": { "type": "string" },
          "description": { "type": "string" },
          "evidence_ids": { "type": "array", "items": { "type": "string" } }
        }
      }
    }
  }
}
